<?xml version="1.0" encoding="UTF-8"?>
<?xml-stylesheet type="text/xsl" href="cv_en.xsl"?>
<cv lang="es" color="teal" xmlns:xsi="http://www.w3.org/2001/XMLSchema-instance" xsi:schemaLocation="cv_data.xsd">
  <photo>photo.jpg</photo>
  <name>Víctor Chico Rodríguez</name>
  <address>Calle Francisco Salzillo 7, 28850 Torrejón de Ardoz (Madrid)</address>
  <email>vchicorod@gmail.com</email>
  <tlf>610664565</tlf>
  <summary>
    <p>
      Lorem ipsum dolor sit amet, consectetur adipiscing elit. Proin a faucibus est. Suspendisse pulvinar erat id orci viverra, id ullamcorper mauris semper. Nulla ullamcorper aliquet iaculis. Phasellus ut facilisis lectus. Vestibulum ante ipsum primis in faucibus orci luctus et ultrices posuere cubilia Curae; Donec tincidunt, neque vel euismod auctor, tortor purus ullamcorper justo, vitae finibus leo ipsum tristique nibh. Duis faucibus vitae felis ac consequat. Pellentesque habitant morbi tristique senectus et netus et malesuada fames ac turpis egestas. Sed nec viverra sem. Ut a magna vel elit consequat bibendum id eget magna. Aenean suscipit suscipit libero, vel dignissim neque. Ut eu purus ipsum. Cras condimentum vel risus quis tincidunt. Nulla facilisi. Nullam nec aliquet massa. Integer quis condimentum risus, sed venenatis lacus.
    </p>
    <p>
      Aliquam tristique turpis nisl, ut accumsan elit tempor at. In hac habitasse platea dictumst. Duis et ligula arcu. Praesent mattis eleifend sollicitudin. Orci varius natoque penatibus et magnis dis parturient montes, nascetur ridiculus mus. Maecenas efficitur lectus diam. Sed arcu tellus, porta a tincidunt quis, finibus efficitur ligula. Morbi dignissim sit amet sem non dapibus. Integer ac imperdiet libero.
    </p>
  </summary>
  <educations type="academic">
    <education start="2017" end="Actualidad">
      <course>Grado en Ingeniería Informática</course>
      <institution>Universitat Oberta de Catalunya</institution>
    </education>
    <education start="2010" end="2012">
      <course>CGFS Desarrollo de aplicaciones informáticas</course>
      <institution>IES Azarquiel, Toledo</institution>
    </education>
  </educations>
  <educations type="complementary">
    <education start="2013" end="2014">
      <course>Cisco CCNA Exploration 1: Network Fundamentals</course>
      <institution>IES Azarquiel, Toledo</institution>
    </education>
    <education start="05-2013" end="06-2013">
      <course>Diseño de páginas web (Dreamweaver, Photoshop, Flash)</course>
      <institution>Forem Castilla - La Mancha, Toledo</institution>
    </education>
  </educations>
  <experiences>
    <experience>
      <company>Dematic</company>
      <projects>
	<project title="Dematic iQ" workplace="Coslada" start="06-2019" end="Actualidad">
	  <description>
	    <p>
	      Desarrollo e implantación de control de almacenes logísticos mediante Java EE utilizando diferentes especificaciones (Jersey, JMS,...).
	    </p>
	  </description>
	</project>
	<project title="Alimerka" workplace="Lugo de llanera, Asturias" start="08-2019" end="08-2019">
	  <description>
	    <p>
	      Puesta en marcha de la instalación realizando diferentes pruebas sobre el hardware real.
	    </p>
	  </description>
	</project>
      </projects>
    </experience>
    <experience>
      <company>atSistemas</company>
      <projects>
	<project title="atresmedia soluciones digitales" workplace="San Sebastián de los Reyes" start="05-2017" end="06-2019">
	  <description>
	    <p>
	      Desarrollo de aplicaciones de gestión de contenidos en código Java EE con Spring y maven utilizando BBDD oracle, MongoDB y Solr e integración con entorno Amazon AWS.
	    </p>

	    <p>
	      Diseño de frontends con GWT con utilización de clasess CSS propias y hojas de estilo externas.
	    </p>

	    <p>
	      Desarrollo de servicios REST utilizando Spring en un entorno orientado al microservicio.
	    </p>

	    <p>
	      Desarrollo de skills para Alexa utilizando el stack de AWS (Lambda, API Gateway, ElasticCache, DynamoDB, etc.).
	    </p>
	  </description>
	</project>
      </projects>
    </experience>
  </experiences>
  <languages>
    <language level="Nativo">Castellano</language>
    <language level="C1 (Cambridge First Certificate in English, FCE Grade A)">Inglés</language>
  </languages>
  <skills>
    <skill>Manejo avanzado de Office y otras herramientas ofimáticas.</skill>
    <skill>Conocimientos en diseño e instalación de redes.</skill>
    <skill>Manejo de diferentes sistemas operativos Windows</skill>
    <skill>Manejo de sistemas operativos tipo Unix en consola y X Windows</skill>
    <skill>Conocimientos de programación en lenguajes estructurados con orientación a objetos.</skill>
    <skill>Conocimiento de la sintaxis de varios lenguajes de programación (COBOL, JAVA, Visual Basic, C, C#, Ruby, HTML, CSS, JavaScript y PLSQL)</skill>
    <skill>Manejo de bases de datos (Oracle, MySQL, postgres, Access)</skill>
    <skill>Conocimientos de tecnología y estructura de computadores</skill>
    <skill>Conocimientos sobre análisis de aplicaciones</skill>
    <skill>Conocimientos de lenguajes de programación funcionales (Haskell, Lisp, Clojure).</skill>
  </skills>
</cv>
